,class_name,class_description,class_style,additional_class_style_info,word_count,unique_word_count,cleaned_text,Balance and Alignment,Stress Relief/Breath Techniques,Deep Relaxation/Mind Practice,Stretch and Release,Core and Strength,dominant_topic,dominant_topic_theme
331,yin yoga,"Often, flexibility comes from not forcing the body into obedience, but getting out of your own way. By letting the body relax into its bone deep structure and opening slowly to breath and surrender we can create space. Yin Yoga is passive but challenging - benefits include increased focus; reduced stress + anxiety; opening connective tissue and fascia of the body to add circulation, flexibility and mobility. We hold variations of seated and reclined poses for 3 to 5 minutes each. Come exactly as you are!",yin,,86,70,often flexibility come force body obedience way let body relax bone deep structure slowly breath surrender create space passive challenge benefit include increase focus reduce stress anxiety connective tissue fascia body add circulation flexibility mobility hold variations seat recline 3 5 minutes come exactly,0.00848917,0.4105921,0.30395904,0.08655046,0.19040924,1,Stress Relief/Breath Techniques
332,Community Classes,"The idea of selfless service (Seva) is an important concept in Yoga - Because everything is perceived as one, serving other people is considered an essential practice in serving your Divine Self. This class is a great way to support graduates of the Daya Teacher Training as they explore their craft, while the community recieves a more accessible practice through . Instructors rotate weekly, so check our schedule to meet our Graduates!",yoga,community,72,59,idea selfless service seva important concept everything perceive serve consider essential serve divine self great way support graduate daya train explore craft community recieves accessible instructors rotate weekly check schedule meet graduate,0.025971487,0.29102343,0.24176966,0.29104564,0.15018977,3,Stretch and Release
333,COMMUNITY ABHAYA EXPRESS - LEVEL 1,"Abhaya Express offers a full spectrum yoga experience, all within 50 min. This class is perfect for the student who needs a more efficient way to practice while maintaining all the general classes of postures. Express is open to all levels and guided by the breath.
Class includes: Sun Salutations, Standing Poses, balancing/ complex Standing Poses, inversion prep, Hip Opening, Backbends, Forward bending, Twists and Rest.
Level 1-All levels welcome. Modifications will be given. Open to the new/mid level practitioners looking for a full spectrum yoga class. Moves at a gentle pace for all levels. Appropriate for beginners, prenatal, and those with ongoing therapeutic issues.",yoga,community,105,81,abhaya express full spectrum experience within 50 min perfect need efficient way maintain general express guide breath include sun salutations stand balance complex stand inversion prep hip backbends forward bend twist rest 1 modifications give mid practitioners look full spectrum gentle pace appropriate beginners prenatal ongoing therapeutic issue,0.84724295,0.008552905,0.008562853,0.1272587,0.008382591,0,Balance and Alignment
334,Core Strength Yoga,"Get ready to breathe, move, and strengthen your core! This class not only focusses your core - promoting better posture, stability, and balance - but will also help to cultivate mental focus and resilience as we challenge ourselves and our core muscles.",yoga,core,42,35,ready breathe strengthen core focus core promote better stability balance help cultivate mental focus resilience challenge core muscle,0.015591639,0.01590556,0.015509687,0.015737278,0.93725586,4,Core and Strength
335,Cathartic Yoga,"Cathartic Yoga is a dynamic whole-body flow rooted in Vinyasa, strength training, and mindfulness to help you feel your best. This barefoot, mat-based, music-driven practice intentionally blends Asana and bodyweight exercises to tone your muscles, cultivate inner resilience, and harness your power to transform your body and mind.",yoga,,48,40,cathartic dynamic whole body root strength train mindfulness help feel best barefoot mat base music drive intentionally blend bodyweight tone muscle cultivate inner resilience harness power transform body mind,0.013393611,0.013632234,0.1622265,0.013596173,0.7971515,4,Core and Strength
336,Open practice,"An asana practice focused on a series of related postures. By focusing the mind through breathwork and continuing into  strengthening poses, we prepare the body to move into more challenging shapes. All levels welcome - modifications are given for each pose and we encourage the use of props in order tailor your practice to the specific shape and structure of your body. Workshop and refine the poses you’re used to, and try some new poses too! ",yoga,,76,60,focus relate focus mind breathwork continue strengthen prepare body challenge shape modifications give encourage use prop order tailor specific shape structure body workshop refine use try,0.17641811,0.014566286,0.0146372095,0.57291967,0.2214587,3,Stretch and Release
337,Sakshi Bhava Yoga,"Sakshi Bhava Yoga is a complete practice incorporating the different elements of yoga - posture, organic movement, core strengthening, and yogic breathing to detox the body and mind. The practice is intense while keeping the essence of meditation throughout the class. A truly transformational and healing experience led by Himalayan Yogi Ananda.",yoga,sakshi bhava,52,44,sakshi bhava complete incorporate different elements organic core strengthen yogic breathe detox body mind intense keep essence throughout truly transformational heal experience lead himalayan yogi ananda,0.017014809,0.27143994,0.017380143,0.016819367,0.67734575,4,Core and Strength
338,TRAUMA-INFORMED YOGA,"Traumas are difficult experiences that impact our ability to cope and live our everyday life. Yoga can provide transformative therapies to come back into the body, empowering humans to begin reclaiming their inner experience. beU trauma-sensitive yoga classes will create a comfortable space for every one of distressing experiences to reconnect to their bodies and their ability to make choices for themselves. Why yoga? Yoga stimulates the core functions of being alive – which are having the ability to breathe, to build up emotional and physical strength, and to make healthy decisions in life.",yoga,trauma informed / with disabilities,94,69,traumas difficult experience impact ability cope live everyday life transformative therapies come back body empower humans reclaim inner experience beu trauma sensitive create comfortable space distress experience reconnect body ability make choices stimulate core function alive ability breathe build emotional physical strength make healthy decisions life,0.009688297,0.79482514,0.009747202,0.009593388,0.17614594,1,Stress Relief/Breath Techniques
339,Trauma Informed Yoga,"This class provides an integrative framework for ​understanding how trauma and chronic stress ​impact the body and mind. This class focuses on ​yoga, somatic practices and meditation for the ​ability to reduce trauma and stress.",yoga,trauma informed / with disabilities,35,27,integrative framework understand trauma chronic stress impact body mind focus somatic ability reduce trauma stress,0.16341788,0.76029724,0.025324581,0.025812306,0.025147956,1,Stress Relief/Breath Techniques
340,Level 1 Alignment,"These foundational classes help students develop a basic understanding of yoga and the common poses (asana) used in most classes. Modifications will be highly emphasized, so practitioners will be empowered to make adjustments on their own as they practice. Students will begin to observe and work with their breath and body positioning. A strong emphasis is placed on alignment in the poses, as opposed to flowing from pose to pose. This class offers a more specific alignment focus as taught by BKS Iyengar, but is not a purely Iyengar-style class, nor always taught by an Iyengar-certified teacher.",yoga,align,97,77,foundational help develop basic understand common use modifications highly emphasize practitioners empower make adjustments observe breath body position strong emphasis place alignment oppose specific alignment focus bks purely always certify,0.17100637,0.01135372,0.011194195,0.7950995,0.011346191,3,Stretch and Release
341,Level 1-2. Alignment,"These mixed-level classes help students develop a more integrated understanding of the yoga practice, with an emphasis on alignment, although flowing postures may also be taught. Modifications will be emphasized, so that practitioners will be empowered to make adjustments to better suit their own bodies. Students will observe and work with their breath and body positioning. This class offers a more specific alignment focus as taught by BKS Iyengar, but is not a purely Iyengar-style class, nor always taught by an Iyengar-certified teacher.",yoga,align,83,69,mix help develop integrate understand emphasis alignment although modifications emphasize practitioners empower make adjustments better suit body observe breath body position specific alignment focus bks purely always certify,0.014672855,0.0146312015,0.014383992,0.9417548,0.0145570915,3,Stretch and Release
342,ALIGN-LEVEL 2,"This class is perfect for those looking for specific structural alignment, attention to detail, and instructions given with direction and clarity. Enjoy a class with movement, challenge and yet inspired freedom in your body and mind.
Align is taught by expert Abhaya instructors with over 10 years in the field of yoga.

Level 2- Geared to the mid level/experienced practitioners. Expect more refined alignment, longer holds, faster pacing at times, options for inversions, options for arm balances. Have a basic understanding of the names of the poses and vinyasa movements.",yoga,align,90,69,perfect look specific structural alignment attention detail instructions give direction clarity enjoy challenge yet inspire freedom body mind align expert abhaya instructors 10 years field 2 gear mid experience practitioners expect refine alignment longer hold faster pace options inversions options arm balance basic understand name movements,0.7467006,0.11594426,0.008592242,0.120304585,0.008458362,0,Balance and Alignment
343,Align to Bliss,"Align to Bliss is a slow yoga that emphasizes alignment, building poses from the ground up, mindfulness and utilization of props. The class is especially welcoming to beginners and anyone coming back to yoga after a hiatus or injuries. It is also great for all those who like to focus on alignment, or enjoy a slower yoga practice to build flexibility, strength and inner focus.",yoga,align,65,51,align bliss slow emphasize alignment build grind mindfulness utilization prop especially beginners come back hiatus injuries great like focus alignment enjoy slower build flexibility strength inner focus,0.010304427,0.084083825,0.010076965,0.8852202,0.010314572,3,Stretch and Release
344,Yoga for anxiety,"Many of us struggle with anxiety and the good news is there’s strong evidence that yoga can help. join Laura for an evidence-informed practice to explore different tools to cope with anxiety including yoga postures, breathwork, and meditation.
This class is not heated.",yoga,anxiety,43,37,us struggle anxiety good news strong evidence help join laura evidence inform explore different tool cope anxiety include breathwork heat,0.5781571,0.020838778,0.3594069,0.020509647,0.021087518,0,Balance and Alignment
345,Back Care,"For all types of back problems, pain and postural problems including scoliosis. Come lengthen your spine and move out of the habitual behaviors that are making your back hurt! All levels welcome including those new to yoga and beginners.",yoga,back care,39,33,type back problems pain postural problems include scoliosis come lengthen spine habitual behaviors make back hurt include beginners,0.023457585,0.908834,0.022249212,0.023136169,0.022323048,1,Stress Relief/Breath Techniques
346,Back Care Basics,"For all types of back problems, pain and postural problems including scoliosis. This class moves a bit slower, and step by step in comparison to the Back Care Classes.",yoga,back care,29,27,type back problems pain postural problems include scoliosis bite slower step step comparison back care,0.033458658,0.86537635,0.033397708,0.034282416,0.03348483,1,Stress Relief/Breath Techniques
347,Back Care Beginners Series,For Brand New Beginners to yoga or to alignment based yoga. These classes cover the basic skills you need to participate in the Back Care & Back Care Basics classes in a progressive manner. You will be taking classes with other new beginners at Samamkaya Yoga and learn many basic actions and prop adjustments appropriate to your back problem or your scoliosis.,yoga,back care,62,49,brand beginners alignment base cover basic skills need participate back care back care basics progressive manner beginners samamkaya basic action prop adjustments appropriate back problem scoliosis,0.015966792,0.015574222,0.015467704,0.937496,0.01549527,3,Stretch and Release
348,Intermediate Back Care / Intermediate Yoga & Scoliosis,For students with mature yoga practice or who have been taking the Yoga & Scoliosis or Back Care class on a regular basis for a minimum of 1 year. All poses will be modified with props and awareness techniques so each student can move along with his/her practice. There will also be some focus on inversions. The Intermediate class is not for new beginners.,yoga,back care,64,55,mature scoliosis back care regular basis minimum 1 year modify prop awareness techniques along focus inversions intermediate beginners,0.40511373,0.18919553,0.02244579,0.3609116,0.022333337,0,Balance and Alignment
349,Yoga & Scoliosis,"For students with a lateral/rotational curvature(s) of the spine. The focus is on extension and working with issues affecting people with scoliosis such as balance, proprioception, strength and reducing compensatory patterns. All levels welcome including those new to yoga.",yoga,back care,39,36,lateral rotational curvature spine focus extension issue affect scoliosis balance proprioception strength reduce compensatory pattern include,0.034785625,0.86179215,0.03352846,0.034046754,0.035846982,1,Stress Relief/Breath Techniques
350,Yoga & Scoliosis Basics,"This class covers the basic information needed to understand the way to work in the Yoga & Scoliosis classes at Samamkaya Yoga, including learning and understanding your own curves, basic poses to charge awareness and gain extension, working with proprioceptive issues and balance.  This class moves slower and more step-by-step than the Open Level Yoga & Scoliosis classes.",yoga,back care,58,44,cover basic information need understand way scoliosis samamkaya include understand curve basic charge awareness gain extension proprioceptive issue balance slower step step scoliosis,0.6416131,0.302934,0.018371522,0.018835071,0.01824625,0,Balance and Alignment
351,Yoga & Scoliosis for Teens & Tweens Series,"This class in appropriate for ages 11-17. All teens are welcome to this class but as idiopathic scoliosis is commonly diagnosed in adolescence, the class will generally focus of scoliosis. This 1-hour class creates an environment that is less intense that the adult classes, allows teens to relate with one another, and is sequenced for a young person’s energy level. Dahlia Galler’s positivity and experience with her own scoliosis will communicate how the love of yoga will lead to a healthier relationship to the body…at a time when this relationship is particularly difficult.",yoga,back care,93,66,appropriate age 11 17 teens idiopathic scoliosis commonly diagnose adolescence generally focus scoliosis 1 hour create environment less intense adult allow teens relate another sequence young person energy dahlia galler positivity experience scoliosis communicate love lead healthier relationship body relationship particularly difficult,0.4150225,0.017253086,0.3516086,0.017108083,0.19900778,0,Balance and Alignment
352,Oui Oui Baby,"Join us for a fun and interactive 40 minute story and sing-song class designed to nurture and stimulate the creativity and imagination of young children in a foreign language. Enter a world of original French stories, songs, puppets, and humorous props and share the adventure with your child. Nurture your child's natural enthusiasm for rhythm, and experience the joy of singing French songs together! No French experience required for child or caregiver.
Diara Bamba - your storytelling guide - is a former high school French teacher and entrepreneur with years of experience in early childhood education. Hailing from Paris, she now lives in Brooklyn with her husband and 5 month old baby girl.",other,,113,83,join us fun interactive 40 story sing song design nurture stimulate creativity imagination young children foreign language enter world original french stories songs puppets humorous prop share adventure child nurture child natural enthusiasm rhythm experience joy sing french songs together french experience require child caregiver diara bamba storytelling guide former high school french entrepreneur years experience early childhood education hail paris live brooklyn husband 5 month old baby girl,0.3011763,0.013705528,0.5276061,0.013925147,0.14358683,2,Deep Relaxation/Mind Practice
353,Yoga of Sacred Geometry,"This class will focus on the use of reference to Great Nature and archetypal shapes within to find functional forms within the body - creating a space for healing, insight, and revelations. Every form within yoga should have function - this class will help students better understand these functions as well as how to build their postures from the ground up with proper measurements and folds. ",yoga,,66,54,focus use reference great nature archetypal shape within find functional form within body create space heal insight revelations form within function help better understand function well build grind proper measurements fold,0.6226798,0.012265597,0.012019536,0.012121852,0.34091324,0,Balance and Alignment
354,Somatic Study,"Somatic study is the study of the body, more specifically of your unique body and how it relates to your energetic and psychological experience. Expect to move, sweat, breathe and rest. Untethered to any one practice, we will weave through different yoga styles (Vinyasa, Hatha, restorative, yin, kundalini, pranayama) as well as other movement practices (ie Qi Cong, Alexander Method), pressure point massage, essential oils and Body mapping . You will leave with tools for self-care and intuitive physical therapy. The class is open to all levels and abilities.",yoga,,89,74,somatic study study body specifically unique body relate energetic psychological experience expect sweat breathe rest untethered weave different restorative well ie qi cong alexander method pressure point massage essential oil body map leave tool self care intuitive physical therapy abilities,0.26264942,0.20342623,0.23648593,0.014476909,0.28296152,4,Core and Strength
355,Women's Rejuvenation Circle,"Rejuvenation Circle
Women's Rejuvenation Workshop is a co-created experience of women supporting women in reclaiming our bodies, beings, and sexualities as our own. We draw power from the archetype of the triple goddess: the Maiden, Mother, and and ever-wise Crone that lies within each of us, and in gathering together, we are able to tap into our deep reserves of wisdom, and healing potential. We believe that the healing and empowerment of women is vital for the healing and empowerment of the world. Through our structure of forming a sacred circle, guided meditation, emotional check-in, ritual, and honoring our bodies' sacred sensuality, we create a healthier, juicier means of being, healing the earth and inviting a more kind and conscious society, one empowered woman at a time.",other,,127,84,rejuvenation circle women rejuvenation workshop co create experience women support women reclaim body sexualities draw power archetype triple goddess maiden mother ever wise crone lie within us gather together able tap deep reserve wisdom heal potential believe heal empowerment women vital heal empowerment world structure form sacred circle guide emotional check ritual honor body sacred sensuality create healthier juicier mean heal earth invite kind conscious society empower woman,0.011095661,0.16197933,0.55747855,0.010579035,0.25886744,2,Deep Relaxation/Mind Practice
356,Sculpt & Tone,"The Yoga Room’s Sculpt & Tone class is a blend of our Barre Fit & Pilates classes with an aerobic undertone that is fast paced and upbeat, working specific muscle groups by use of high repetition to create definition without bulk. Each teacher has a unique style that makes every class a fun challenge, helping you to build full body strength and stability with each exercise.",yoga,,66,56,sculpt tone blend fit pilates aerobic undertone fast pace upbeat specific muscle group use high repetition create definition without bulk unique make fun challenge help build full body strength stability,0.0116524305,0.011231059,0.011179346,0.011320251,0.95461696,4,Core and Strength
357,Tai Chi,"What is Tai Chi all about? Tai Chi refers to the natural balance of life energy. Since ancient times, people have noticed that Nature tends to find balance, and they’ve developed methods to tap into this natural energy phenomenon. We can say that many energy practices, like Qigong and various healing martial arts, are forms of Tai Chi.
How does Tai Chi work?
Tai Chi exercises emphasize energy circulation, breathing and balance, along with mindfulness and concentration. You can practice these exercises while standing, seated or even while lying down. Over time, by practicing Tai Chi you can develop a heightened awareness of your own energy. Many people report feeling physically stronger and lighter, with emotions more calm and mind more clear.
Benefits of Tai Chi
What is Tai Chi good for? Tai Chi practice is recommended for overall wellness. It can help with balance, alignment, and stress reduction. Tai Chi exercises can also serve as a form of meditation. Tai Chi energy-balancing exercises are great for people of all ages, and can be adapted for your own condition. You may experience:
 Less stress
 Improved mood
 Increased energy and stamina
 Reduced chronic pain
 Improved sleep
 Improved flexibility, balance and agility
 Improved muscle strength and definition",tai chi,,205,130,tai tai refer natural balance life energy since ancient notice nature tend find balance develop methods tap natural energy phenomenon say energy like qigong various heal martial arts form tai tai tai emphasize energy circulation breathe balance along mindfulness concentration stand seat lie tai develop heighten awareness energy report feel physically stronger lighter emotions calm mind clear benefit tai tai good tai recommend overall wellness help balance alignment stress reduction tai serve form tai energy balance great age adapt condition experience less stress improve mood increase energy stamina reduce chronic pain improve sleep improve flexibility balance agility improve muscle strength definition,0.004252091,0.18929948,0.004197985,0.11792871,0.68432176,4,Core and Strength
358,Yoga,"Develop your strength, flexibility, breathing, and energy with our Body & Brain yoga classes. You may notice that our yoga classes offer a variety of exercises and poses, helping to keep your practice fun and dynamic while consistently covering the basics. Each Body & Brain yoga class not only trains your body but helps center your awareness inside yourself. Through our signature breathing postures you can accumulate energy and strengthen your core, leaving you feeling recharged, relaxed, and refreshed.
WHAT TO EXPECT DURING OUR
YOGA CLASSES
After a short set of warm up exercises, you'll get into meridian stretching (to improve circulation, strength and flexibility, and relax the mind) followed by core strengthening and breathing postures to accumulate energy. Then you’ll be guided in the practice of energy meditation (called jigam, meaning ‘to quiet the mind’) and a few cool down exercises. After class you’re always welcome to enjoy tea and sharing time with your instructor and classmates.",yoga,,158,116,develop strength flexibility breathe energy body brain notice variety help keep fun dynamic consistently cover basics body brain train body help center awareness inside signature breathe accumulate energy strengthen core leave feel recharge relax refresh expect short warm meridian stretch improve circulation strength flexibility relax mind follow core strengthen breathe accumulate energy guide energy call jigam mean quiet mind cool always enjoy tea share instructor classmates,0.03910313,0.0050589223,0.3006444,0.004962023,0.6502315,4,Core and Strength
359,Rise (65min),"Start the day with Strength & Sensitivity! Breath-led Sun Salutations move into foundational poses priming the body for core strength conditioning and a few twists and turns along the way.
The resulting awakening of the spine will render your body alert and intuitive for the progression of your day.",yoga,,49,39,strength sensitivity breath lead sun salutations foundational prim body core strength condition twist turn along way result awaken spine render body alert intuitive progression,0.022655275,0.29778564,0.022888081,0.023015298,0.6336557,4,Core and Strength
360,Sweat (65min),"A rigorous flow of sweat-inducing, stamina-building yoga postures that include standing poses, twists, shoulder opening backbends, that provide the perfect break for your lunch hour or the occasion to de-stress at the end of your day.",yoga,,36,31,rigorous sweat induce stamina build include stand twist shoulder backbends perfect break lunch hour occasion de stress end,0.4050739,0.15078749,0.22720878,0.02258467,0.19434516,0,Balance and Alignment
