,class_name,class_description,class_style,additional_class_style_info,word_count,unique_word_count,cleaned_text,Balance and Alignment,Stress Relief/Breath Techniques,Deep Relaxation/Mind Practice,Stretch and Release,Core and Strength,dominant_topic,dominant_topic_theme
228,Restorative,This is a practice that is all about slowing down and opening your body through passive stretching. During the long holds of restorative your muscles are allowed to relax deeply by using props for support. Great when you're stressed and/or not sleeping enough.,restore,,43,41,slow body passive stretch long hold restorative muscle allow relax deeply use prop support great stress sleep enough,0.014329013,0.014530307,0.41183004,0.46258256,0.09672807,3,Stretch and Release
229,REST & RESTORE,"When Restoration is called for, whether physically, mentally, or emotionally; this class is designed to support you, to release tension by allowing props to do the yoga for you and activating the parasympathetic nervous system. As you allow your body to release tension, you create blood flow and space for your body, mind, and soul to rest and restore.  (Unheated- use of bolsters/pillows, blankets, and blocks)",restore,,66,51,restoration call whether physically mentally emotionally design support release tension allow prop activate parasympathetic nervous allow body release tension create blood space body mind soul rest restore unheated use bolster pillow blanket block,0.010177355,0.010096039,0.65207213,0.31752133,0.010133132,2,Deep Relaxation/Mind Practice
230,RESTORATIVE YOGA,"Expect long holds in supported, relaxing poses. Restorative Yoga offers therapeutic tools to balance the nervous system in order to truly rest and replenish energy. Students will access states of deep mind and body relaxation through the architecture of restorative poses. Health benefits of a consistent restorative practice may include lowered blood pressure and blood sugar levels, reduced insomnia or anxiety, balanced menstruation, improved digestion.",yoga,restore,65,55,expect long hold support relax restorative therapeutic tool balance nervous order truly rest replenish energy access state deep mind body relaxation architecture restorative health benefit consistent restorative include lower blood pressure blood sugar reduce insomnia anxiety balance menstruation improve digestion,0.12689921,0.09110753,0.6923367,0.008824452,0.080832094,2,Deep Relaxation/Mind Practice
231,Restorative Yoga,"In this crazy world we live in it is common to find ourselves existing in fight or flight mode (running from a bear!) in our day to day lives. This class is a chance to carve out space for quiet and stillness, so that the rest and digest portion of your nervous system can get some much needed TLC. Choose rest as a priority! This practice is totally passive and supported with props, and is perfect for anyone and everyone.
",yoga,restore,80,63,crazy world live common find exist fight flight mode run bear live chance carve space quiet stillness rest digest portion nervous much need tlc choose rest priority totally passive support prop perfect everyone,0.01557895,0.13365164,0.8192386,0.015966846,0.0155639695,2,Deep Relaxation/Mind Practice
232,Unwind & Restore,"Unwind & Restore is a blend of gentle, yin and restorative yoga. The practice is very meditative with emphasis on breathing techniques that sooth and rebalance the body and mind. The long holds provide opportunity to go deep into the poses, increasing flexibility in the tendons, ligaments and even fascia. At the same time the props allow  us to modify the poses to make them safe and appropriate for all levels of yoga students, from beginner to advanced
",restore,,78,63,unwind restore blend gentle restorative meditative emphasis breathe techniques sooth rebalance body mind long hold opportunity deep increase flexibility tendons ligaments fascia prop allow us modify make safe appropriate advance,0.07732718,0.21852878,0.4124086,0.22200343,0.06973205,2,Deep Relaxation/Mind Practice
233,Restore,Props are used to support the body fully for no muscular effort in creating the poses. Experience ease and no strain during the long holds which allow for deep internal reflection and the nervous system to shift into rest and digest.,restore,,41,33,prop use support body fully muscular effort create experience ease strain long hold allow deep internal reflection nervous shift rest digest,0.015644323,0.01565338,0.9371699,0.015976092,0.015556295,2,Deep Relaxation/Mind Practice
234,RESTORATIVE YOGA,"In this gentle class you will truly learn what it is to relax. This class is practiced solely on the mat in restful and reclined positions using blankets, bolsters and blocks to support your body and release all tension. It is the perfect way to relieve stress and connect with the self. No yoga experience required.",yoga,restore,56,46,gentle truly relax solely mat restful recline position use blanket bolster block support body release tension perfect way relieve stress connect self experience require,0.011381426,0.011499711,0.38041276,0.58551604,0.011190124,3,Stretch and Release
235,Restorative Yoga,"Restorative Yoga, brings deep relaxation and balance to ​both the mind and body. This style of yoga typically ​consists of only a few postures. Props such as blankets, ​bolsters, blocks, and straps are offered in different ​variations and can be adjusted in each pose as needed.",yoga,restore,46,40,restorative bring deep relaxation balance mind body typically consist prop blanket bolster block strap different variations adjust need,0.07888686,0.015738305,0.2868908,0.6026011,0.015882952,3,Stretch and Release
236,Restorative,Start your morning or end your day with this rejuvenating and slow paced restorative practice to bring in gentle movement for the day ahead or evening awaiting. You'll awaken the body and move with grace and ease. Props are incorporated.,restore,,40,33,morning end rejuvenate slow pace restorative bring gentle ahead await awaken body grace ease prop incorporate,0.01853417,0.018201478,0.44266436,0.50224775,0.01835224,3,Stretch and Release
237,Caroline's Weekend Restorative,Cap off your weekend with this rejuvenating and slow paced restorative practice to bring in gentle movement for the week that awaits you. You'll awaken the body and move with grace and ease. Props are incorporated. All levels are welcome.,restore,,40,35,cap weekend rejuvenate slow pace restorative bring gentle week await awaken body grace ease prop incorporate,0.01853417,0.018255144,0.44261476,0.5022438,0.018352095,3,Stretch and Release
238,restorative,"Restorative yoga is a passive healing practice that encourages physical, mental, and emotional relaxation. This style of yoga is known for its ability to activate the parasympathetic nervous system and induce the relaxation response already available in the body. Appropriate for all levels, Restorative is practiced at a slow pace focusing on long holds (10-15 minutes per pose), stillness, and deep breathing with the use of props such as blocks, bolsters, towels, and/or blankets (BYOB), allowing you to feel comfortable and supported.",yoga,restore,82,68,restorative passive heal encourage physical mental emotional relaxation know ability activate parasympathetic nervous induce relaxation response already available body appropriate restorative slow pace focus long hold 10 15 minutes per stillness deep breathe use prop block bolster towel blanket byob allow feel comfortable support,0.080229536,0.15711643,0.5026772,0.25284225,0.0071346154,2,Deep Relaxation/Mind Practice
239,SPA,"“Yoga Spa offers customers multiple treatments to optimize wellness and sustainable health. The minimal, colorful, fragrant atmosphere makes it clear that Yoga Spa was built to provide visitors a relaxing home away from home, away from the city’s frantic energy. ”   - Huffington Post",other,,44,40,spa customers multiple treatments optimize wellness sustainable health minimal colorful fragrant atmosphere make clear spa build visitors relax home away home away city frantic energy huffington post,0.033517085,0.034680817,0.25563243,0.03404294,0.6421267,4,Core and Strength
240,Ashtanga Inspired Vinyasa,"The Ashtanga primary series - also known as Yoga Chikitsa, meaning yoga therapy - is practiced for its cleansing and toning effects on the mind, body and spirit. It’s sequenced practice grows into poses, class after class, as your body marries with the muscle memory of repetition. This class will be physically challenging as we follow pieces of the traditional Ashtanga sequence. All levels are welcome as this is a great introduction to a powerful practice. ",vinyasa,ashtanga,76,63,primary know chikitsa mean therapy cleanse tone effect mind body spirit sequence grow body marry muscle memory repetition physically challenge follow piece traditional sequence great introduction powerful,0.01456764,0.2719011,0.24960802,0.1794196,0.2845036,4,Core and Strength
241,Vinyasa,"This invigorating and dynamic class is for anyone who enjoys twisting, turning, bending backwards and going upside down — or wants to learn how! Move with your breath and transition from one pose to another. The class builds strength, stamina, and flexibility, and will leave you feeling young and happy like a kid again.",vinyasa,,54,47,invigorate dynamic enjoy twist turn bend backwards upside want breath transition another build strength stamina flexibility leave feel young happy like kid,0.16062666,0.015610367,0.24878614,0.4922175,0.082759336,3,Stretch and Release
242,Meridian Vinyasa,"Get in tune with your body! Each pose stimulates specific meridians throughout the body, encouraging a balanced energy flow of from head-to-toe, and promoting a greater sense of mental wellness through physical mindfulness.",vinyasa,,33,31,tune body stimulate specific meridians throughout body encourage balance energy head toe promote greater sense mental wellness physical mindfulness,0.0295651,0.029217191,0.02878632,0.028592497,0.8838389,4,Core and Strength
243,Lunch Express  (for beginners),"A shorter flowing practice that packs many of the benefits of our vinyasa classes into your lunch hour. Because it’s just 45 minutes long, this class is perfect for those who work nearby and need a midday break between meetings and Zoom calls. You’ll feel that extra boost of energy that will help power you through the rest of the day.",vinyasa,foundations,61,53,shorter pack benefit lunch hour 45 minutes long perfect nearby need midday break meet zoom call feel extra boost energy help power rest,0.10017088,0.14193624,0.4996453,0.016951768,0.2412958,2,Deep Relaxation/Mind Practice
244,Vinyasa II,"Prior yoga experience required. Marrying breath with movement, this practice will introduce more advanced Asana & dynamic sequences. Come bring your Vinyasa practice to a new level!",vinyasa,,27,26,prior experience require marry breath introduce advance dynamic sequence come bring,0.6554961,0.022577967,0.27666536,0.022852298,0.022408297,0,Balance and Alignment
245,45min Beginners Ashtanga Vinyasa Yoga,"What is Ashtanga Yoga?
In Sanskrit, ashtanga means eight-limbed (asta- eight, anga- limb). Ashtanga Yoga is an eight-limbed path towards achieving the state of Yoga, also known as Samadhi. 
The definition of Ashtanga Yoga is found in the Yoga Sutras of Patañjali, an ancient text on the theory and practice of Yoga thought to have been compiled in about 200 CE by Sage Patañjali. 
The Yoga Sutras of Patañjali is comprised of 196 sutras- short philosophical statements - on the theory and practice of Yoga, divided into four books, or padas. The Yoga Sutras are so succinct and are therefore almost incomprehensible without commentary. The most definitive commentary is by Veda Vyasa; his commentary is known as the Yoga Bhasya.
The Yoga Sutras begin with the highest teachings first, for those ready to enter into the final limbs of practice. In the second sutra of the first chapter, Samadhi Pada, we are offered the definition of Yoga: “Yogas citta vritti nirodah”, which can be translated as “Yoga is the cessation of the fluctuations of the mind.” When the mind is stilled, and the state of Yoga is reached, the individual mind is at one with the Universal Mind and individual consciousness with Divine Consciousness, and we experience our divinity through unity. 
Yoga is not only the state of Yoga, but also the practice, or sadhana, we engage in on the path towards Yoga. 
The definition of the eight-limbed path that leads to Yoga is found in book two of the Yoga Sutras of Patañjali, Sadhana Pada, the chapter on yoga practice. Sutra 2.29 states: “Yama-niyama-asana-pranayama-pratyahara-dharana-dyana-samadhyaya-astavangani.” This can be translated as: “the eight limbs of yoga are yama, niyama, asana, pranayama, pratyahara, dharana, dhyana, and samadhi.” ",vinyasa,ashtanga,285,158,sanskrit mean eight limbed asta eight anga limb eight limbed path towards achieve state know samadhi definition find sutras pata jali ancient text theory think compile 200 ce sage pata jali sutras pata jali comprise 196 sutras short philosophical statements theory divide four book padas sutras succinct therefore almost incomprehensible without commentary definitive commentary veda vyasa commentary know bhasya sutras highest first ready enter final limbs second sutra first chapter samadhi pada definition yogas citta vritti nirodah translate cessation fluctuations mind mind still state reach individual mind universal mind individual consciousness divine consciousness experience divinity unity state sadhana engage path towards definition eight limbed path lead find book two sutras pata jali sadhana pada chapter sutra 2 29 state yama niyama pratyahara dharana dyana samadhyaya astavangani translate eight limbs yama niyama pratyahara dharana dhyana samadhi,0.011420504,0.9547918,0.01128104,0.011158686,0.01134796,1,Stress Relief/Breath Techniques
246,FOUNDATIONAL VINYASA,"The Urban Sadhu Yoga Foundational Vinyasa, the second stage in the course, will work as a structured learning curriculum that will allow a student to apply what was learned in Urban Sadhu Yoga Fundamentals to a vinyasa class style class and build onto that knowledge. This class type was developed out of our observation that many students needed a transitional program from Urban Sadhu Yoga Fundamentals of Yoga to Urban Sadhu Yoga Open Classes. This class type will prepare and give them the skills and confidence to move forward. The course is divided into 4 sections: week 1 standing asanas, week 2 forward fold asanas, week 3 back bending asanas, and week 4 inversions.",vinyasa,foundations,114,73,urban sadhu foundational second stage course structure curriculum allow apply urban sadhu fundamentals build onto knowledge type develop observation need transitional program urban sadhu fundamentals urban sadhu type prepare give skills confidence forward course divide 4 section week 1 stand asanas week 2 forward fold asanas week 3 back bend asanas week 4 inversions,0.32219678,0.42507848,0.23404852,0.009372462,0.009303765,1,Stress Relief/Breath Techniques
247,Open Level Vinyasa Yoga,"This hour long, open level class will focus on traditional yoga postures, fluid sequences, and breathing practices. Variations and modifications are available for practitioners of all levels, so that each student can experience a balance of effort and ease in their practice. Come ready to move and breathe and leave feeling centered and refreshed.",vinyasa,,54,48,hour long focus traditional fluid sequence breathe variations modifications available practitioners experience balance effort ease come ready breathe leave feel center refresh,0.4226742,0.19318376,0.36016527,0.012001196,0.011975517,0,Balance and Alignment
248,Radiance Flow /Radiance Hour (Open Level) - (Vinyasa Yoga),"Radiance Flow /Radiance Hour (Open Level) - (Vinyasa Yoga) This class turns up the heat to radiant! It builds to a vigorous (medium to fast paced) flow and it includes some advanced asanas.  It is recommended that you have knowledge of the basic yoga postures in advance. Modifications are welcomed and will be offered, whether to make the poses more accessible or more challenging.  The practice gradually mellows out to finish with a blissful meditation and savasana.",vinyasa,flow,77,66,radiance radiance hour turn heat radiant build vigorous medium fast pace include advance asanas recommend knowledge basic advance modifications whether make accessible challenge gradually mellow finish blissful savasana,0.6848991,0.1381538,0.01370382,0.1496203,0.013622984,0,Balance and Alignment
249,Vinyasa Yoga,"Vinyasa Yoga classes are slower moving and offer a less vigorous flow between poses but an equal challenge of endurance, flexibility and strength to our Vinyasa Flow classes.",vinyasa,,28,26,slower less vigorous equal challenge endurance flexibility strength,0.04043945,0.040711567,0.04001538,0.5245152,0.3543184,3,Stretch and Release
250,VINYASA (60 or 75min),"Welcoming practitioners of various fitness & lifestyle routines, this medium intensity class seamlessly transitions you from one posture to the next working & stretching in equal measure arms, legs, hips, glutes, front & back body. Poses in this multi-level class are weaved together in a rhythmic manner through the incorporation of breath at every level of the practice. With no more than 3 postures to a side, the sequences are well balanced so as not to fatigue muscles and overload joints – thus keeping the mind vibrant and continuously aware of its potential.
Expect to feel the power of your breath while developing full body strength and stability.",vinyasa,,108,85,practitioners various fitness lifestyle routines medium intensity seamlessly transition next stretch equal measure arm legs hips glut front back body multi weave together rhythmic manner incorporation breath 3 side sequence well balance fatigue muscle overload joint thus keep mind vibrant continuously aware potential expect feel power breath develop full body strength stability,0.26245725,0.008655707,0.18557093,0.13652125,0.40679488,4,Core and Strength
251,Community Class,This vinyasa based Community Yoga Class is taught by rotating instructors who are graduates from Kala's Yoga Teacher Training or new yoga teachers on our amazing Work Exchange Team! These classes are offered on a donation basis to the community. It's a great way to allow a space for all to practice and for aspiring yoga teachers to blossom in their teaching skills!,yoga,community,63,52,base community rotate instructors graduate kala train amaze exchange team donation basis community great way allow space aspire blossom skills,0.029212112,0.029116996,0.5372083,0.20723307,0.19722947,2,Deep Relaxation/Mind Practice
252,Vinyasa Yoga,Mixed Level - Vinyasa Yoga will help you find the space between poses while retaining the rhythm of a flow yoga class.,vinyasa,,22,21,mix help find space retain rhythm,0.41985896,0.45876887,0.04050467,0.040508572,0.040358897,1,Stress Relief/Breath Techniques
253,Community Karma Class,"Vinyasa Flow!
We're excited to announce a series of classes in our space to support our beloved community🕊
'Community is when people begin to care about one another, sharing things that are important to one another. Yoga is one of those things

The community class celebrates our diverse community coming together for a higher purpose, a deeper meaning, and for a more profound goal in life—and that is consciousness.
As a studio, donations are appreciated to help keep the lights on, provide a safe space for everyone in the community, and help support positive change.",karma,community,95,66,excite announce space support beloved community community care another share things important another things community celebrate diverse community come together higher purpose deeper mean profound goal life consciousness studio donations appreciate help keep light safe space everyone community help support positive change,0.013768897,0.6134293,0.3455875,0.013502527,0.01371177,1,Stress Relief/Breath Techniques
254,Community Classes,"Practice Traditional Hot or Hot Vinyasa for only $12 in one of our Community Classes! Choose the “$12 Community Class” option when you book online. If you have an unlimited package, you can also book these classes with it.",yoga,community,39,34,traditional 12 community choose 12 community option book online unlimited package book,0.100355044,0.1004155,0.59679914,0.10000192,0.10242842,2,Deep Relaxation/Mind Practice
255,Vinyasa,"This energizing class emphasizes proper alignment and breath work as we move through sun salutations and vinyasa (flow). Each class offers a unique sequence to either highlight certain muscle groups or to accommodate a central focus; be it arm balances, inversions, or backbends. Modifications are always offered so that the fun can be shared by yogis of all levels.",vinyasa,,59,53,energize emphasize proper alignment breath sun salutations unique sequence either highlight certain muscle group accommodate central focus arm balance inversions backbends modifications always fun share yogis,0.43488118,0.012540147,0.012639174,0.16692778,0.37301168,0,Balance and Alignment
256,Vinyasa,"Vinyasa yoga strings poses (asanas) and breath (pranayama) together into a fluid sequence of movements. Focus is not solely on the poses but on the transitions between poses as well. The fluidity of Vinyasa can help bring practitioners into a flow state, where the entire mind is absorbed in the present activity. This practice increases flexibility, strength and balance while reducing stress and increasing mental clarity.",vinyasa,,66,53,string asanas breath together fluid sequence movements focus solely transition well fluidity help bring practitioners state entire mind absorb present activity increase flexibility strength balance reduce stress increase mental clarity,0.107530974,0.3453992,0.23257579,0.008885381,0.3056087,1,Stress Relief/Breath Techniques
257,Evening Vinyasa Flow,"Unwind from your day and shed excess tension with this fluid, open level practice. This class will mobilize the body with creative vinyasa sequencing, then calm and balance the nervous system with a soothing and restful finish. This class is for practitioners of all levels.",vinyasa,flow,45,38,unwind shed excess tension fluid mobilize body creative sequence calm balance nervous soothe restful finish practitioners,0.34494007,0.028693961,0.5684278,0.02916439,0.028773814,2,Deep Relaxation/Mind Practice
258,Evening Creative Vinyasa Flow,End your day with this fun and vibrant traditional vinyasa flow. You'll blend traditional technique with creative sequencing to keep your practice fresh and versatile! All levels are welcome.,vinyasa,flow,29,25,end fun vibrant traditional blend traditional technique creative sequence keep fresh versatile,0.022301521,0.022246577,0.91052586,0.022299519,0.022626566,2,Deep Relaxation/Mind Practice
259,Vinyasa Flow,"Vinyasa Flow classes are faster moving classes, you will move with music from one pose to another.",vinyasa,flow,17,17,faster music another,0.10020031,0.5964257,0.10238335,0.10000313,0.10098749,1,Stress Relief/Breath Techniques
260,Vinyasa,"An all-levels vinyasa class, linking deep breaths to mindful body movements. This class is offered by donation; you will not be charged when signing up. Donations will be accepted at the door.",vinyasa,,32,30,link deep breaths mindful body movements donation charge sign donations accept door,0.04072336,0.040056475,0.8382038,0.040690266,0.040326137,2,Deep Relaxation/Mind Practice
261,Vinyasa Flow,"In Vinyasa Flow, we focus on cultivating breath and movement in an approachable and fun series of flows. The class will build strength and flexibility in your physical body while unleashing your inner bliss. Heated Vinyasa Flow classes use infrared radiant heat panels to make the room feel about 90 degrees, while non-heated classes are about 75-80 degrees. Come see all that yoga has to offer you!",vinyasa,flow,67,58,focus cultivate breath approachable fun build strength flexibility physical body unleash inner bliss heat use infrared radiant heat panel make feel 90 degrees non heat 75 80 degrees come see,0.12881055,0.0114753125,0.011234759,0.011337365,0.837142,4,Core and Strength
262,Vinyasa yoga,"Vinyasa yoga is a sequence of postures that aims to tone the muscles, calm the mind, and strengthen the spirit. It is a dynamic sequences where poses flow into one another while synchronizing the breath with the movements. This practice aims at a continuous flow rather than holding the postures for extended period of time, relieving stress and expanding mindfulness.",vinyasa,,60,47,sequence aim tone muscle calm mind strengthen spirit dynamic sequence another synchronize breath movements aim continuous rather hold extend period relieve stress expand mindfulness,0.014543793,0.014929153,0.5201111,0.20364878,0.24676718,2,Deep Relaxation/Mind Practice
