,class_name,class_description,class_style,additional_class_style_info,word_count,unique_word_count,cleaned_text,Balance and Alignment,Stress Relief/Breath Techniques,Deep Relaxation/Mind Practice,Stretch and Release,Core and Strength,dominant_topic,dominant_topic_theme
0,Aerial,These classes use an aerial silk to create poses with less gravitational pull on the body and a more compression-free practice. The playful flight-like experience has the power to boost mood and imagination while challenging your boundary of security.,aerial,,39,36,use silk create less gravitational pull body compression free playful flight like experience power boost mood imagination challenge boundary security,0.029488612,0.18203121,0.02896525,0.029540453,0.7299745,4,Core and Strength
1,Aerial,"Relax your mind and align your body with aerial yoga. A gently guided yoga flow elevated inside of a hammock. Our supportive aerial instructors help you feel comfortable during any class. An unforgettable experience to help you unwind after a long day. The entire class is safely guided for maximum growth mentally and physically. Our style of aerial yoga is designed to help you get out of your comfort zone and motivate you towards your fullest potential of overall wellness. Our aerial classes are taught in a small intimate setting to help each student feel seen. We've designed the space to encourage community support and unity. No charge for hammocks.
 
Anyone can take an aerial class at our studio, no matter your experience level. Our silk hammocks are professionally installed and can hold up to 2000 pounds. 
In our opinion, Aerial Yoga is more mental than physical. We believe we can't grow physically unless we let go mentally. Our aerial classes are taught in a small intimate setting to help each student feel seen. We've designed the space to encourage community support. The purpose behind adding aerial to our studio is meant for us to learn more about our bodies amazing abilities, change our mental perspective and connect deeper to our bodies needs. 
The Benefits of Aerial Yoga

Deepens stretches

Relieves joint pressure and spinal compression that floor workouts can trigger

Releases tension

Increases balance and proprioception (bodily awareness)

Enhances core strength

Improves breath awareness

Easier access to inverted postures

Releases endorphins",aerial,,252,162,relax mind align body gently guide elevate inside hammock supportive instructors help feel comfortable unforgettable experience help unwind long entire safely guide maximum growth mentally physically design help comfort zone motivate towards fullest potential overall wellness small intimate help feel see design space encourage community support unity charge hammocks studio matter experience silk hammocks professionally instal hold 2000 pound opinion mental physical believe grow physically unless let mentally small intimate help feel see design space encourage community support purpose behind add studio mean us body amaze abilities change mental perspective connect deeper body need benefit deepen stretch relieve joint pressure spinal compression floor workouts trigger release tension increase balance proprioception bodily awareness enhance core strength improve breath awareness easier access invert release endorphins,0.12075911,0.0038984003,0.3939295,0.003922154,0.47749084,4,Core and Strength
2,Aerial Yoga,Aerial Yoga (Open Level) - this class is for existing yoga practitioners but no aerial experience is required! We will do our best to make this an amazing experience for beginner to advanced aerial yogis alike! Let's fly!,aerial,,38,32,exist practitioners experience require best make amaze experience advance yogis alike let fly,0.67373943,0.23999427,0.028620517,0.02892836,0.028717393,0,Balance and Alignment
3,Ashtanga Yoga,Ashtanga Yoga involves synchronization between the breaths and movements. One can obtain a strong life force (Prana) and purification of the body through sweating.  Regular practice of Ashtanga will bring a balance of flexibility and strength of the body and internalize the awareness.,ashtanga,,43,31,involve synchronization breaths movements obtain strong life force prana purification body sweat regular bring balance flexibility strength body internalize awareness,0.36519328,0.02049729,0.020523777,0.020268876,0.5735168,4,Core and Strength
4,Ashtanga Yoga,"Ashtanga Yoga is a systematic Vinyasa-style class, incorporating set sequences or “series” where the breath and movement are united. The energetic nature of the sequence leads to a cleansing of the body through heat – enhancing circulation, alleviating joint pain, and building strength. When the postures are executed enough to be performed graciously, breathing becomes more even and ultimately cleanses the nervous system. Ashtanga Yoga allows you to develop a deep awareness of your breath and body. Similar to Bikram Yoga, the rigid sequence is known to help students develop a routine of self-discipline, grit, and consistency. This practice pushes you beyond your limits, constantly reminding you that you’re capable of much more than you realize!
In a led class, you are guided with a precise and traditional counting method, combined with specific breathing cues and points of focus, or “Drishti’s.” The cues help us keep our minds steady and focused throughout the class.
Ashtanga Yoga is usually practiced at room temperature, but we heat the room to 90 degrees. The heat relaxes your muscles, allowing you to go deeper into postures quickly.",ashtanga,,183,122,systematic incorporate sequence breath unite energetic nature sequence lead cleanse body heat enhance circulation alleviate joint pain build strength execute enough perform graciously breathe become ultimately cleanse nervous allow develop deep awareness breath body similar rigid sequence know help develop routine self discipline grit consistency push beyond limit constantly remind capable much realize lead guide precise traditional count method combine specific breathe cue point focus drishti cue help us keep mind steady focus throughout usually temperature heat 90 degrees heat relax muscle allow deeper quickly,0.17147715,0.048173413,0.40972033,0.0044557434,0.36617342,2,Deep Relaxation/Mind Practice
5,Baptiste Yoga,"""In order to make it easier to endure difficulties in life, they should first be experienced on the mat in the hall"", says the American yoga teacher Baron Baptiste, founder of the Baptiste Power Yoga.
This practice is a unique combination of physical training and meditation that helps to deal with stress and improve physical body.
Do you want to try a yoga trend, which gives an opportunity to people who are tense in the everyday life of a megalopolis, to strengthen your body through intense physical training, find flow and relax? Come to Baptiste Power Yoga classes at Studio One Yoga NYC.
What is Baptiste Power Yoga?
Baptiste Power Yoga is a yoga trend developed by Baron Baptiste based on the Baptiste Power Vinyasa style, which appeared more than 80 years ago thanks to his father, Walt Baptiste, a world-famous bodybuilder and Mr. America.
Baptiste Power Yoga is a symbiosis of practices based on the teachings of Walt Baptiste, B.K.S. Iyengar and Bikram Choudhury. It successfully combines elements of Ashtanga vinyasa, Bikram yoga and Iyengar yoga. The Baptiste Power Yoga is a vinyasa yoga, which includes a set of hatha yoga asanas and is held in a room heated to 100 degrees Fahrenheit, it is an intense workout that will literally make you sweat.
In general, the philosophy of Baron Baptiste yoga is a way to ground practitioners in the physical body, and from this state to encourage them to explore their own inner world.
Five Pillars of Baptiste Power Yoga
Breathing - is ujjayi; when the back of the throat is greatly strained and compressed, outwardly it looks like breathing to fog up a mirror when a person inhales and exhales through the nose. This technique allows you to develop the ability to slow down breathing, making it strong and deep, which is necessary during the practice of complex asanas. In addition, practitioners note that such breathing helps to keep calm.
Heat - is an opportunity to kindle an inner fire (tapas); therefore, to create such an atmosphere classes are held in the so–called hot halls;
Flow - is also associated with vinyasa–based breathing. In this series there are exercises that are performed standing up and work with the abdomen, back, and hips.
The direction of gaze - is drishti, this is one of the components of ashtanga yoga, which means looking at a certain place while performing yoga poses. Students are taught to focus their attention on any static point while doing exercises. This technique allows you to learn how to distract attention from everything external, focusing on yourself.
Core Stabilisation – uddiyana bandha, aimed at developing balance and strength. The exercises themselves are a retraction of the navel to the spine.
Features
Classes are suitable for both men and women of any age and all levels of physical condition. Baptiste Yoga NYC has developed special lightweight complexes for beginners and full–fledged workouts for all muscle groups for advanced students. Trainings can take place both in a hot room and at the room temperature.
Baptiste Yoga classes are highly appreciated by professional athletes engaged in athletics and martial arts. In addition, the practice has become very popular among those who want to quickly put the body in order and learn the basics of yoga.
One of the attractive advantages of this practice is the ability to lose weight quickly, and without special exhausting diets. Intensive workout in a heated room provides the necessary calorie consumption. With a consistent practice, you can quickly put your body in order, build up muscles, slimdown and relief. Among other important results of this practice, there is an increase in tone, mood, the ability to feel harmony with the world.
There are almost no limitations to practicing this practice, except for those who suffer from cardiovascular diseases, hypertension, acute colds (flu) with increased body temperature.
Where to practice?
Come to practice at One Yoga NYC Studio. We have a team of educated and experienced teachers. All our teachers have at least 500-hour training, and our leaders have dozens of trainings and thousands of mentoring hours behind their backs.
In January 2022, we opened our first yoga studio in New York.
There is now an opportunity to practice the most popular yoga trends in the heart of Downtown.
You can sign up for Bikram Yoga, Baptiste Power Yoga, Jivamukti yoga, Inferno Hot Pilates classes and other classes that will help you to find harmony with yourself and the world, and achieve a balance of physical and emotional state.",baptiste,,755,388,order make easier endure difficulties life first experience mat hall say american baron baptiste founder baptiste power unique combination physical train help deal stress improve physical body want try trend give opportunity tense everyday life megalopolis strengthen body intense physical train find relax come baptiste power studio baptiste power baptiste power trend develop baron baptiste base baptiste power appear 80 years ago thank father walt baptiste world famous bodybuilder mr america baptiste power symbiosis base walt baptiste b k choudhury successfully combine elements baptiste power include asanas hold heat 100 degrees fahrenheit intense workout literally make sweat general philosophy baron baptiste way grind practitioners physical body state encourage explore inner world five pillars baptiste power breathe ujjayi back throat greatly strain compress outwardly look like breathe fog mirror person inhale exhale nose technique allow develop ability slow breathe make strong deep necessary complex asanas addition practitioners note breathe help keep calm heat opportunity kindle inner fire tapas therefore create atmosphere hold call halls associate base breathe perform stand abdomen back hips direction gaze drishti components mean look certain place perform focus attention static point technique allow distract attention everything external focus core stabilisation uddiyana bandha aim develop balance strength retraction navel spine feature suitable men women age physical condition baptiste develop special lightweight complexes beginners full fledge workouts muscle group advance train place temperature baptiste highly appreciate professional athletes engage athletics martial arts addition become popular among want quickly put body order basics attractive advantage ability lose weight quickly without special exhaust diet intensive workout heat necessary calorie consumption consistent quickly put body order build muscle slimdown relief among important result increase tone mood ability feel harmony world almost limitations except suffer cardiovascular diseases hypertension acute colds flu increase body temperature come studio team educate experience least 500 hour train leaders dozens train thousands mentor hours behind back january 2022 first studio opportunity popular trend heart downtown sign baptiste power pilates help find harmony world achieve balance physical emotional state,0.10740445,0.19555418,0.08249013,0.10662081,0.50793046,4,Core and Strength
6,Barre Fit,"Our 55-minute Barre Fit™ Classes target the muscles like never before, with a mega-focus on your legs, gluts and abs. Think ballet body, as these intelligent exercises create firm, elongated muscles, a stronger and flatter abdomen, a nice butt lift, and toned upper-legs and upper-arms.
This method is one of the fastest, safest and most effective ways to re-shape your body, nipping everything in and lifting everything up. It’s low impact so it protects your joints from bouncing. AND finally, it’s challenging for all levels due to the modifications of the exercises.",barre,,92,76,55 fit target muscle like never mega focus legs glut abs think ballet body intelligent create firm elongate muscle stronger flatter abdomen nice butt lift tone upper legs upper arm method fastest safest effective ways shape body nip everything lift everything low impact protect joint bounce finally challenge due modifications,0.21713017,0.016966987,0.016802803,0.017371533,0.7317285,4,Core and Strength
7,YogaBarre,"A fusion of yoga, Barre and Pilates. A beginner-friendly yet challenging and unique workout designed to sculpt and strengthen your entire body. connecting with the breath, mind, body, and spirit philosophies of yoga.",barre,,33,28,fusion pilates friendly yet challenge unique workout design sculpt strengthen entire body connect breath mind body spirit philosophies,0.017152876,0.123384744,0.017246298,0.017231349,0.8249847,4,Core and Strength
8,FLOOR BARRE.,A ballet-inspired workout that will lengthen and strengthen your muscles and core.  You are guaranteed to discover muscles you didn’t know you owned as you are led through this series of exercises at the Barre as well as the mat.,barre,,40,32,ballet inspire workout lengthen strengthen muscle core guarantee discover muscle know lead well mat,0.018208645,0.38155493,0.018339276,0.01838212,0.563515,4,Core and Strength
9,back to basics (for beginners),"Focus on basic poses, pranayama and meditation techniques that yogis will return to time and time again. This class provides beginners with a foundation for a lifelong yoga practice. Flexibility is is not required! Experienced students will also benefit by refining their alignment and transitions in preparation for more advanced poses.",yoga,,51,44,focus basic techniques yogis return beginners foundation lifelong flexibility require experience benefit refine alignment transition preparation advance,0.62874633,0.13632388,0.20102741,0.016970968,0.016931394,0,Balance and Alignment
10,Beginner’s Yoga,"Whether you’re looking to learn the basics, or are a seasoned yogi seeking a refresher, welcome to Daya! Practice the foundation of all poses, link your movement with breath, and discover proper alignment to receive the full benefits of a healthy yoga practice. Open to all levels!",yoga,,47,38,whether look basics season yogi seek refresher daya foundation link breath discover proper alignment receive full benefit healthy,0.5426208,0.028572813,0.37046346,0.029395854,0.028947107,0,Balance and Alignment
11,Yoga Fundamentals,"Yoga Fundamentals will break down some of the most common postures (asanas) and remind us how to correctly embody them while understanding benefits of the posture.
",yoga,,26,24,fundamentals break common asanas remind us correctly embody understand benefit,0.04407965,0.040167615,0.8340422,0.041538984,0.04017158,2,Deep Relaxation/Mind Practice
12,Basics class,This class will explore the foundational building blocks of yoga postures. We will move at a slower and more methodical pace than in our all-levels classes. Great for beginners!,yoga,,29,28,explore foundational build block slower methodical pace great beginners,0.022928666,0.022375826,0.022246331,0.9099993,0.02244984,3,Stretch and Release
13,FUNDAMENTALS OF YOGA,"A yoga 101 workshop style course geared for students new to yoga, but all levels are welcome to these classes, which focus on the fundamentals of yoga asana. The course is divided into 4 sections: week 1 standing asanas, week 2 forward fold asanas, week 3 back bending asanas, and week 4 putting it together.  Over a 4-week period the student will learn to pay special attention to yoga asana alignment, the use of yoga props and helpful tips according to the Urban Sadhu Yoga Method. These are the tools that will form a solid yoga practice for students through their entire lives!!",yoga,,103,77,101 workshop course gear focus fundamentals course divide 4 section week 1 stand asanas week 2 forward fold asanas week 3 back bend asanas week 4 put together 4 week period pay special attention alignment use prop helpful tip accord urban sadhu method tool form solid entire live,0.2639737,0.009354675,0.7075528,0.009530932,0.009587925,2,Deep Relaxation/Mind Practice
14,Yoga Foundations,"Learn what all the hype is about! This class is devoted to the newcomer who wants to build their practice from the ground up. Students will explore breath practices, standing sequences, seated poses, and an introduction to backbends. This class is ideal for those who are new to yoga or for anyone who wants to brush up on the basics.",yoga,,60,45,hype devote newcomer want build grind explore breath stand sequence seat introduction backbends ideal want brush basics,0.26837495,0.1372597,0.022670355,0.54918176,0.022513235,3,Stretch and Release
15,Foundations,"No previous experience is necessary for this lovely class that exposes new and experienced yogis alike to the beauty that is yoga. This basic, foundational class focusses on breath, postures, and alignment. Appropriate for those looking to dip their toes into yoga for the first time, as well as those with experience who are looking to deepen their practice by going back to the basics. You can’t go wrong no matter where you are on your yoga journey.",yoga,,78,59,previous experience necessary lovely expose experience yogis alike beauty basic foundational focus breath alignment appropriate look dip toe first well experience look deepen back basics wrong matter journey,0.5925831,0.013812811,0.013412928,0.36677933,0.013411766,0,Balance and Alignment
16,FOUNDATION HUM,"Discover the fundamentals and learn within a supportive environment.
This practice will provide a well-rounded offering that is both educational and exploratory. Offering fundamental instruction, the teacher will lead students through rudimentary sequences, breath-work and meditation techniques that allow for curious practice. Expect posture breakdowns and explanation of accompanying movement. No prior yoga experience is required. Beginners welcome. 
All classes are guided alongside our curated “Hum”, a soundscape designed to enhance focus, and will conclude with a soothing sound bath. Heated at 80 degrees.",yoga,,84,72,discover fundamentals within supportive environment well round educational exploratory fundamental instruction lead rudimentary sequence breath techniques allow curious expect breakdowns explanation accompany prior experience require beginners guide alongside curated hum soundscape design enhance focus conclude soothe sound bath heat 80 degrees,0.7093991,0.14973348,0.11959431,0.010671741,0.010601347,0,Balance and Alignment
17,Absolute Beginners,Our semi-private or small group series with master teacher Gina is absolutely great for beginners or wanting to go revisit the fundamentals.,yoga,,22,21,semi private small group master gina absolutely great beginners want revisit fundamentals,0.04094585,0.040066652,0.04000257,0.63517284,0.24381208,3,Stretch and Release
18,BEGINNERS YOGA,"This class is specially designed for those entirely new to yoga, the perfect class to introduce you to yoga, come and join us! Open to all levels.

Tune-up Chaturangas, align your Warriors or just get your breath flowing right.",yoga,,39,33,specially design entirely perfect introduce come join us tune chaturangas align warriors breath right,0.3707158,0.029373262,0.542179,0.028898658,0.028833315,2,Deep Relaxation/Mind Practice
19,Bikram yoga,"Bikram yoga is a 26 posture series with two breathing exercises performed inside a 105-degree room with 40% humidity. Bikram yoga may sound intimidating- don’t let that stop you from getting down to it! The postures are specifically designed for beginners and people of different shapes and sizes! It is a great class for everyone who wants to lose weight and at the same time gain muscle strength and increase bone density. The overwhelming heat and humidity completely submerges you into mental stillness, leaving you feeling calm, steady, and optimistic after class. Bikram yoga is highly recommended for people with back, neck, and shoulder pain, knee injuries, and other health issues. As you observe the people who come to a typical Bikram class, you will see people who have been practicing for a few months and people who have been practicing for a few decades. A consistent Bikram practice has the power for individuals to learn discipline, resilience, and patience. So let’s get sweaty!",hot yoga / bikram,,164,114,26 two breathe perform inside 105 40 humidity sound intimidate let stop specifically design beginners different shape size great everyone want lose weight gain muscle strength increase bone density overwhelm heat humidity completely submerge mental stillness leave feel calm steady optimistic highly recommend back neck shoulder pain knee injuries health issue observe come typical see months decades consistent power individuals discipline resilience patience let sweaty,0.14794154,0.008691135,0.008602388,0.2850953,0.5496696,4,Core and Strength
20,Bikram Beats,"Bikram Beats is the usual 26 postures and two breathing exercises, but instead of the traditional dialog, it is accompanied by chill beats that will tune you into each pose. Rather than verbal instruction, the class is formatted by following the teacher’s lead; the teacher only cues you in and out of the postures. This is not your standard Bikram Yoga class, as you get a chance to practice side-by-side with an experienced teacher and listen to some groovy tunes! From Rock n’ Roll, cross-cultural genres, house, and classical music, our diverse yoga mixtape is catered to every individual’s taste in music. Due to limited instruction, the class is only recommended for people familiar with the sequence- but beginners are never turned away!",hot yoga / bikram,,123,93,beat usual 26 two breathe instead traditional dialog accompany chill beat tune rather verbal instruction format follow lead cue standard chance side side experience listen groovy tune rock n roll cross cultural genres house classical music diverse mixtape cater individual taste music due limit instruction recommend familiar sequence beginners never turn away,0.17709759,0.64799404,0.14085083,0.016935593,0.01712197,1,Stress Relief/Breath Techniques
